{
  "schemaVersion": 1,
  "kind": "current-admission",
  "provider": "AzureKeyVault",
  "policy": "complete-live",
  "sources": [
    {
      "file": "src/SecretKit.AzureKeyVault.Management/AuditDiagnostics.cs",
      "sha256": "2ed2a9fcde491448620c1765685b2abcc027f7923a0bef4ee01923e00ee5b5b5"
    },
    {
      "file": "src/SecretKit.AzureKeyVault.Management/ControlledTransport.cs",
      "sha256": "c8808ac38de406e88574e7b055d253c334aa360f32bde06d0ec09bdc76d5dd74"
    },
    {
      "file": "src/SecretKit.AzureKeyVault.Management/ManagementOperation.cs",
      "sha256": "088977d59b3c506284d8955d842d9f328d9c645306cffb9f01c7d3d4f1b3a587"
    },
    {
      "file": "src/SecretKit.AzureKeyVault.Management/NativeModels.cs",
      "sha256": "864ee441d4f742149cfa364a8846ba088e3e9c3d9ec9f7d85cf28c463e134ddb"
    },
    {
      "file": "src/SecretKit.AzureKeyVault.Management/NotificationAdministration.cs",
      "sha256": "e92bfaef902d236a0f786b533bff3df944442e26f426f79335b26bd715cb44e7"
    },
    {
      "file": "src/SecretKit.AzureKeyVault.Management/NotificationModels.cs",
      "sha256": "110ad2686a07b701b6dfe4b36418aa7fd035a9e7e71f61e1ec27b07b3b41a401"
    },
    {
      "file": "src/SecretKit.AzureKeyVault.Management/OperationSupport.cs",
      "sha256": "ebdf6e6a1fd8a91bdbdd36f6883ba1847bb3f985a20b499d5caef47a154ff167"
    },
    {
      "file": "src/SecretKit.AzureKeyVault.Management/RoleAdministration.cs",
      "sha256": "7f00d8480cc4193d42926abedc30dfa33a1d0a4872304fcc22abfa6a6cc482ed"
    },
    {
      "file": "src/SecretKit.AzureKeyVault.Management/Scopes.cs",
      "sha256": "719fa2d70f58da530d51b81690609af7754040dc77eafca045ff817d158a0fae"
    },
    {
      "file": "src/SecretKit.AzureKeyVault.Management/VaultAdministration.cs",
      "sha256": "6e449c7c04fb39475ed64317c9e03eb8051435362d1382b52e220d697f74635d"
    },
    {
      "file": "src/SecretKit.AzureKeyVault/AzureKeyVaultClient.cs",
      "sha256": "7c99904b7e92d2be82689762f471b12250e62210b3f95d6088c5db753930524e"
    },
    {
      "file": "src/SecretKit.AzureKeyVault/AzureNativeLifecycle.cs",
      "sha256": "00d0c32b91fecd4a1fbba4d4039a45d388895b18c842e27b69e06476bf5fe005"
    },
    {
      "file": "src/SecretKit.AzureKeyVault/AzureNativeModels.cs",
      "sha256": "029106ba86c30737180a0f945975856575e7e6ca5a4e30557693dfa958e7ca6b"
    },
    {
      "file": "src/SecretKit.AzureKeyVault/AzureSecretAddress.cs",
      "sha256": "316ab95936ce57f76539ea4fff6b50e013db2fa659a38eeb8bce1ddc12cb18da"
    },
    {
      "file": "src/SecretKit.AzureKeyVault/AzureSetSecret.cs",
      "sha256": "b7bf42aa18bc956248927c7650dd6eb50ca8737cd45468b92c6634b13f2bd4b3"
    }
  ],
  "operations": [
    {
      "id": "a.runtime.AzureKeyVaultClient.BackupSecretAsync",
      "member": "SecretKit.AzureKeyVault.AzureKeyVaultClient.BackupSecretAsync(SecretKit.Core.SecretReference,System.Threading.CancellationToken)",
      "variants": [
        "selector.exact"
      ],
      "contract": "implemented-subset",
      "effect": "Validate an opaque all-version backup by restoring into an authorized compatible target and independently comparing version/material state; artifact acquisition is not portable export or rename.",
      "requiredCases": [
        "selected-contract",
        "denied-authority",
        "cancellation-boundary",
        "independent-effect"
      ],
      "prerequisites": [
        "owned-origin-api-revision",
        "selected-runtime-identity",
        "separate-observer-identity",
        "approved-sandbox-cleanup",
        "azure-tenant-subscription",
        "azure-selected-cloud-endpoint",
        "azure-backup-restore-rights",
        "same-subscription-geography"
      ]
    },
    {
      "id": "a.runtime.AzureKeyVaultClient.CheckLifecycleStatusAsync",
      "member": "SecretKit.AzureKeyVault.AzureKeyVaultClient.CheckLifecycleStatusAsync(SecretKit.AzureKeyVault.AzureLifecycleOperation,System.Threading.CancellationToken)",
      "variants": [
        "kind.Delete.Pending",
        "kind.Delete.Applied",
        "kind.Recover.Pending",
        "kind.Recover.Applied"
      ],
      "contract": "implemented-subset",
      "effect": "Independently observe the selected vault secret/version, material or lifecycle transition with a separate credential; returned version, metadata or acknowledgement alone does not establish downstream access.",
      "requiredCases": [
        "selected-contract",
        "denied-authority",
        "cancellation-boundary",
        "independent-effect"
      ],
      "prerequisites": [
        "owned-origin-api-revision",
        "selected-runtime-identity",
        "separate-observer-identity",
        "approved-sandbox-cleanup",
        "azure-tenant-subscription",
        "azure-selected-cloud-endpoint"
      ]
    },
    {
      "id": "a.runtime.AzureKeyVaultClient.GetDeletedSecretAsync",
      "member": "SecretKit.AzureKeyVault.AzureKeyVaultClient.GetDeletedSecretAsync(SecretKit.Core.SecretReference,System.Threading.CancellationToken)",
      "variants": [
        "selector.exact"
      ],
      "contract": "implemented-subset",
      "effect": "Independently observe the selected vault secret/version, material or lifecycle transition with a separate credential; returned version, metadata or acknowledgement alone does not establish downstream access.",
      "requiredCases": [
        "selected-contract",
        "denied-authority",
        "cancellation-boundary",
        "independent-effect"
      ],
      "prerequisites": [
        "owned-origin-api-revision",
        "selected-runtime-identity",
        "separate-observer-identity",
        "approved-sandbox-cleanup",
        "azure-tenant-subscription",
        "azure-selected-cloud-endpoint",
        "azure-delete-recover-purge-rights",
        "azure-retention-policy"
      ]
    },
    {
      "id": "a.runtime.AzureKeyVaultClient.GetDeletedSecretsAsync",
      "member": "SecretKit.AzureKeyVault.AzureKeyVaultClient.GetDeletedSecretsAsync(SecretKit.AzureKeyVault.AzureInventoryScope,System.Threading.CancellationToken)",
      "variants": [
        "selector.exact",
        "page.complete",
        "page.page-budget",
        "page.item-budget"
      ],
      "contract": "implemented-subset",
      "effect": "Independently observe the selected vault secret/version, material or lifecycle transition with a separate credential; returned version, metadata or acknowledgement alone does not establish downstream access.",
      "requiredCases": [
        "selected-contract",
        "denied-authority",
        "cancellation-boundary",
        "independent-effect"
      ],
      "prerequisites": [
        "owned-origin-api-revision",
        "selected-runtime-identity",
        "separate-observer-identity",
        "approved-sandbox-cleanup",
        "azure-tenant-subscription",
        "azure-selected-cloud-endpoint",
        "azure-delete-recover-purge-rights",
        "azure-retention-policy"
      ]
    },
    {
      "id": "a.runtime.AzureKeyVaultClient.GetSecretVersionAsync",
      "member": "SecretKit.AzureKeyVault.AzureKeyVaultClient.GetSecretVersionAsync(SecretKit.Core.SecretReference,System.Threading.CancellationToken)",
      "variants": [
        "version.exact.valid",
        "version.exact.disabled",
        "version.exact.not-yet-valid",
        "version.exact.expired"
      ],
      "contract": "implemented-subset",
      "effect": "Independently observe the selected vault secret/version, material or lifecycle transition with a separate credential; returned version, metadata or acknowledgement alone does not establish downstream access.",
      "requiredCases": [
        "selected-contract",
        "denied-authority",
        "cancellation-boundary",
        "independent-effect"
      ],
      "prerequisites": [
        "owned-origin-api-revision",
        "selected-runtime-identity",
        "separate-observer-identity",
        "approved-sandbox-cleanup",
        "azure-tenant-subscription",
        "azure-selected-cloud-endpoint"
      ]
    },
    {
      "id": "a.runtime.AzureKeyVaultClient.GetSecretVersionsAsync",
      "member": "SecretKit.AzureKeyVault.AzureKeyVaultClient.GetSecretVersionsAsync(SecretKit.Core.SecretReference,SecretKit.AzureKeyVault.AzureInventoryScope,System.Threading.CancellationToken)",
      "variants": [
        "selector.exact",
        "page.complete",
        "page.page-budget",
        "page.item-budget"
      ],
      "contract": "implemented-subset",
      "effect": "Independently observe the selected vault secret/version, material or lifecycle transition with a separate credential; returned version, metadata or acknowledgement alone does not establish downstream access.",
      "requiredCases": [
        "selected-contract",
        "denied-authority",
        "cancellation-boundary",
        "independent-effect"
      ],
      "prerequisites": [
        "owned-origin-api-revision",
        "selected-runtime-identity",
        "separate-observer-identity",
        "approved-sandbox-cleanup",
        "azure-tenant-subscription",
        "azure-selected-cloud-endpoint"
      ]
    },
    {
      "id": "a.runtime.AzureKeyVaultClient.InspectAsync",
      "member": "SecretKit.AzureKeyVault.AzureKeyVaultClient.InspectAsync(SecretKit.Core.SecretInventoryScope,System.Threading.CancellationToken)",
      "variants": [
        "selector.exact",
        "page.complete",
        "page.page-budget",
        "page.item-budget"
      ],
      "contract": "implemented-subset",
      "effect": "Independently observe the selected vault secret/version, material or lifecycle transition with a separate credential; returned version, metadata or acknowledgement alone does not establish downstream access.",
      "requiredCases": [
        "selected-contract",
        "denied-authority",
        "cancellation-boundary",
        "independent-effect"
      ],
      "prerequisites": [
        "owned-origin-api-revision",